{
  "patient_id": "P0059",
  "scenario": "routine",
  "demographics": {
    "name": "Scott Thomas",
    "age": 89,
    "gender": "non-binary",
    "phone": "(584)721-0205",
    "email": "thompsonbrian@hotmail.com",
    "preferred_channel": "phone",
    "language": "English"
  },
  "discharge": {
    "date": "2026-09-21",
    "diagnosis": "Type 2 diabetes with hyperglycemia",
    "summary": "Admitted with blood glucose above 400 mg/dL; insulin started and diabetes education provided.",
    "warning_signs": [
      "confusion",
      "blood sugar above 300",
      "fainting"
    ]
  },
  "medications": [
    {
      "name": "Insulin glargine",
      "dose": "18 units",
      "frequency": "at bedtime",
      "change": "new"
    },
    {
      "name": "Metformin",
      "dose": "1000 mg",
      "frequency": "twice daily",
      "change": "unchanged"
    }
  ],
  "appointments": [
    {
      "appointment_id": "P0059-A1",
      "type": "Specialist clinic visit",
      "date": "2026-10-10",
      "critical": true,
      "status": "scheduled"
    },
    {
      "appointment_id": "P0059-A3",
      "type": "Medication review",
      "date": "2026-10-16",
      "critical": false,
      "status": "scheduled"
    },
    {
      "appointment_id": "P0059-A2",
      "type": "Physical therapy session",
      "date": "2026-10-21",
      "critical": false,
      "status": "scheduled"
    }
  ],
  "responses": [
    {
      "date": "2026-09-23",
      "channel": "phone",
      "status": "responded",
      "message": "Yes, my daughter will drive me."
    },
    {
      "date": "2026-09-25",
      "channel": "phone",
      "status": "responded",
      "message": "Feeling better, see you then."
    }
  ]
}