{
  "patient_id": "P0007",
  "scenario": "warning_symptom",
  "demographics": {
    "name": "Gina Carter",
    "age": 77,
    "gender": "female",
    "phone": "(570)448-2814",
    "email": "kathryn88@gmail.com",
    "preferred_channel": "email",
    "language": "English"
  },
  "discharge": {
    "date": "2026-09-23",
    "diagnosis": "Community-acquired pneumonia",
    "summary": "Treated with IV antibiotics, switched to oral therapy; oxygen weaned before discharge.",
    "warning_signs": [
      "fever above 38.5 C",
      "shortness of breath",
      "coughing blood"
    ]
  },
  "medications": [
    {
      "name": "Amoxicillin-clavulanate",
      "dose": "875 mg",
      "frequency": "twice daily for 5 days",
      "change": "new"
    },
    {
      "name": "Paracetamol",
      "dose": "500 mg",
      "frequency": "as needed",
      "change": "unchanged"
    }
  ],
  "appointments": [
    {
      "appointment_id": "P0007-A3",
      "type": "Specialist clinic visit",
      "date": "2026-10-22",
      "critical": true,
      "status": "scheduled"
    },
    {
      "appointment_id": "P0007-A1",
      "type": "Medication review",
      "date": "2026-10-25",
      "critical": false,
      "status": "scheduled"
    },
    {
      "appointment_id": "P0007-A2",
      "type": "Lab test (bloodwork)",
      "date": "2026-10-25",
      "critical": false,
      "status": "scheduled"
    }
  ],
  "responses": [
    {
      "date": "2026-09-25",
      "channel": "email",
      "status": "responded",
      "message": "I'll try to come, but I've had shortness of breath since yesterday."
    }
  ]
}