{
  "patient_id": "P0029",
  "scenario": "warning_symptom",
  "demographics": {
    "name": "Michael Powell",
    "age": 34,
    "gender": "male",
    "phone": "(272)398-0699",
    "email": "dtaylor@gmail.com",
    "preferred_channel": "sms",
    "language": "English"
  },
  "discharge": {
    "date": "2026-09-28",
    "diagnosis": "Ischaemic stroke (minor)",
    "summary": "Minor stroke with resolving left arm weakness; started on secondary prevention.",
    "warning_signs": [
      "new weakness or numbness",
      "slurred speech",
      "severe headache"
    ]
  },
  "medications": [
    {
      "name": "Aspirin",
      "dose": "75 mg",
      "frequency": "once daily",
      "change": "new"
    },
    {
      "name": "Atorvastatin",
      "dose": "80 mg",
      "frequency": "at night",
      "change": "new"
    }
  ],
  "appointments": [
    {
      "appointment_id": "P0029-A2",
      "type": "Lab test (bloodwork)",
      "date": "2026-10-07",
      "critical": false,
      "status": "scheduled"
    },
    {
      "appointment_id": "P0029-A3",
      "type": "Specialist clinic visit",
      "date": "2026-10-08",
      "critical": true,
      "status": "scheduled"
    },
    {
      "appointment_id": "P0029-A1",
      "type": "Physical therapy session",
      "date": "2026-10-11",
      "critical": false,
      "status": "scheduled"
    }
  ],
  "responses": [
    {
      "date": "2026-09-30",
      "channel": "sms",
      "status": "responded",
      "message": "I'll try to come, but I've had slurred speech since yesterday."
    }
  ]
}