{
  "patient_id": "P0026",
  "scenario": "routine",
  "demographics": {
    "name": "Kristin Stewart",
    "age": 66,
    "gender": "male",
    "phone": "001-979-586-8727x74348",
    "email": "scott43@yahoo.com",
    "preferred_channel": "phone",
    "language": "English"
  },
  "discharge": {
    "date": "2026-09-20",
    "diagnosis": "Community-acquired pneumonia",
    "summary": "Treated with IV antibiotics, switched to oral therapy; oxygen weaned before discharge.",
    "warning_signs": [
      "fever above 38.5 C",
      "shortness of breath",
      "coughing blood"
    ]
  },
  "medications": [
    {
      "name": "Amoxicillin-clavulanate",
      "dose": "875 mg",
      "frequency": "twice daily for 5 days",
      "change": "new"
    },
    {
      "name": "Paracetamol",
      "dose": "500 mg",
      "frequency": "as needed",
      "change": "unchanged"
    }
  ],
  "appointments": [
    {
      "appointment_id": "P0026-A1",
      "type": "Post-op wound check",
      "date": "2026-10-16",
      "critical": true,
      "status": "scheduled"
    },
    {
      "appointment_id": "P0026-A2",
      "type": "Primary care visit",
      "date": "2026-10-23",
      "critical": false,
      "status": "scheduled"
    }
  ],
  "responses": [
    {
      "date": "2026-09-22",
      "channel": "phone",
      "status": "responded",
      "message": "Yes, my daughter will drive me."
    }
  ]
}