{
  "patient_id": "P0003",
  "scenario": "routine",
  "demographics": {
    "name": "Monica Herrera",
    "age": 32,
    "gender": "female",
    "phone": "(518)349-5931x0341",
    "email": "oramirez@yahoo.com",
    "preferred_channel": "email",
    "language": "English"
  },
  "discharge": {
    "date": "2026-09-20",
    "diagnosis": "Heart failure exacerbation",
    "summary": "Admitted with shortness of breath and leg swelling; diuresed and discharged on adjusted diuretics.",
    "warning_signs": [
      "chest pain",
      "shortness of breath",
      "weight gain over 2 kg in 2 days"
    ]
  },
  "medications": [
    {
      "name": "Furosemide",
      "dose": "40 mg",
      "frequency": "once daily",
      "change": "changed"
    },
    {
      "name": "Lisinopril",
      "dose": "10 mg",
      "frequency": "once daily",
      "change": "unchanged"
    },
    {
      "name": "Metoprolol succinate",
      "dose": "25 mg",
      "frequency": "once daily",
      "change": "new"
    }
  ],
  "appointments": [
    {
      "appointment_id": "P0003-A1",
      "type": "Primary care visit",
      "date": "2026-10-18",
      "critical": false,
      "status": "scheduled"
    }
  ],
  "responses": [
    {
      "date": "2026-09-22",
      "channel": "email",
      "status": "responded",
      "message": "Got it, confirmed."
    }
  ]
}