{
  "patient_id": "P0012",
  "scenario": "single_miss",
  "demographics": {
    "name": "Savannah Garcia",
    "age": 62,
    "gender": "female",
    "phone": "+1-880-213-2677x3602",
    "email": "ybaker@yahoo.com",
    "preferred_channel": "sms",
    "language": "English"
  },
  "discharge": {
    "date": "2026-09-18",
    "diagnosis": "Type 2 diabetes with hyperglycemia",
    "summary": "Admitted with blood glucose above 400 mg/dL; insulin started and diabetes education provided.",
    "warning_signs": [
      "confusion",
      "blood sugar above 300",
      "fainting"
    ]
  },
  "medications": [
    {
      "name": "Insulin glargine",
      "dose": "18 units",
      "frequency": "at bedtime",
      "change": "new"
    },
    {
      "name": "Metformin",
      "dose": "1000 mg",
      "frequency": "twice daily",
      "change": "unchanged"
    }
  ],
  "appointments": [
    {
      "appointment_id": "P0012-A1",
      "type": "Physical therapy session",
      "date": "2026-10-16",
      "critical": false,
      "status": "scheduled"
    },
    {
      "appointment_id": "P0012-A2",
      "type": "Medication review",
      "date": "2026-10-20",
      "critical": false,
      "status": "scheduled"
    }
  ],
  "responses": [
    {
      "date": "2026-09-20",
      "channel": "sms",
      "status": "responded",
      "message": "Picked up the new prescription, thanks."
    },
    {
      "date": "2026-09-22",
      "channel": "sms",
      "status": "responded",
      "message": "Yes, my daughter will drive me."
    },
    {
      "date": "2026-09-24",
      "channel": "sms",
      "status": "no_response",
      "message": ""
    }
  ]
}