{
  "patient_id": "P0023",
  "scenario": "routine",
  "demographics": {
    "name": "Stephanie Gilbert",
    "age": 67,
    "gender": "female",
    "phone": "968-504-4369x9577",
    "email": "yleon@hotmail.com",
    "preferred_channel": "email",
    "language": "English"
  },
  "discharge": {
    "date": "2026-09-24",
    "diagnosis": "Heart failure exacerbation",
    "summary": "Admitted with shortness of breath and leg swelling; diuresed and discharged on adjusted diuretics.",
    "warning_signs": [
      "chest pain",
      "shortness of breath",
      "weight gain over 2 kg in 2 days"
    ]
  },
  "medications": [
    {
      "name": "Furosemide",
      "dose": "40 mg",
      "frequency": "once daily",
      "change": "changed"
    },
    {
      "name": "Lisinopril",
      "dose": "10 mg",
      "frequency": "once daily",
      "change": "unchanged"
    },
    {
      "name": "Metoprolol succinate",
      "dose": "25 mg",
      "frequency": "once daily",
      "change": "new"
    }
  ],
  "appointments": [
    {
      "appointment_id": "P0023-A1",
      "type": "Physical therapy session",
      "date": "2026-10-15",
      "critical": false,
      "status": "scheduled"
    },
    {
      "appointment_id": "P0023-A2",
      "type": "Primary care visit",
      "date": "2026-10-18",
      "critical": false,
      "status": "scheduled"
    }
  ],
  "responses": [
    {
      "date": "2026-09-26",
      "channel": "email",
      "status": "responded",
      "message": "Picked up the new prescription, thanks."
    },
    {
      "date": "2026-09-28",
      "channel": "email",
      "status": "responded",
      "message": "Yes, my daughter will drive me."
    }
  ]
}