{
  "patient_id": "P0016",
  "scenario": "single_miss",
  "demographics": {
    "name": "Christopher Bass",
    "age": 45,
    "gender": "male",
    "phone": "001-449-680-8412x411",
    "email": "cassandra53@hotmail.com",
    "preferred_channel": "sms",
    "language": "English"
  },
  "discharge": {
    "date": "2026-09-27",
    "diagnosis": "Laparoscopic appendectomy",
    "summary": "Uncomplicated appendectomy; tolerating diet and pain controlled with oral analgesia.",
    "warning_signs": [
      "fever above 38.5 C",
      "worsening abdominal pain",
      "wound redness or discharge"
    ]
  },
  "medications": [
    {
      "name": "Paracetamol",
      "dose": "1 g",
      "frequency": "four times daily as needed",
      "change": "new"
    }
  ],
  "appointments": [
    {
      "appointment_id": "P0016-A3",
      "type": "Physical therapy session",
      "date": "2026-10-09",
      "critical": false,
      "status": "scheduled"
    },
    {
      "appointment_id": "P0016-A1",
      "type": "Lab test (bloodwork)",
      "date": "2026-10-11",
      "critical": false,
      "status": "scheduled"
    },
    {
      "appointment_id": "P0016-A2",
      "type": "Specialist clinic visit",
      "date": "2026-10-18",
      "critical": true,
      "status": "scheduled"
    }
  ],
  "responses": [
    {
      "date": "2026-09-29",
      "channel": "sms",
      "status": "no_response",
      "message": ""
    }
  ]
}