{
  "patient_id": "P0066",
  "scenario": "non_responder",
  "demographics": {
    "name": "Paula Bradley",
    "age": 39,
    "gender": "male",
    "phone": "802-929-0147",
    "email": "nperry@hotmail.com",
    "preferred_channel": "phone",
    "language": "English"
  },
  "discharge": {
    "date": "2026-09-21",
    "diagnosis": "Type 2 diabetes with hyperglycemia",
    "summary": "Admitted with blood glucose above 400 mg/dL; insulin started and diabetes education provided.",
    "warning_signs": [
      "confusion",
      "blood sugar above 300",
      "fainting"
    ]
  },
  "medications": [
    {
      "name": "Insulin glargine",
      "dose": "18 units",
      "frequency": "at bedtime",
      "change": "new"
    },
    {
      "name": "Metformin",
      "dose": "1000 mg",
      "frequency": "twice daily",
      "change": "unchanged"
    }
  ],
  "appointments": [
    {
      "appointment_id": "P0066-A1",
      "type": "Specialist clinic visit",
      "date": "2026-10-20",
      "critical": true,
      "status": "scheduled"
    }
  ],
  "responses": [
    {
      "date": "2026-09-23",
      "channel": "phone",
      "status": "no_response",
      "message": ""
    },
    {
      "date": "2026-09-25",
      "channel": "phone",
      "status": "no_response",
      "message": ""
    }
  ]
}