{
  "patient_id": "P0020",
  "scenario": "routine",
  "demographics": {
    "name": "Thomas Bailey",
    "age": 70,
    "gender": "female",
    "phone": "730.836.5414",
    "email": "sheila14@gmail.com",
    "preferred_channel": "phone",
    "language": "English"
  },
  "discharge": {
    "date": "2026-09-19",
    "diagnosis": "Heart failure exacerbation",
    "summary": "Admitted with shortness of breath and leg swelling; diuresed and discharged on adjusted diuretics.",
    "warning_signs": [
      "chest pain",
      "shortness of breath",
      "weight gain over 2 kg in 2 days"
    ]
  },
  "medications": [
    {
      "name": "Furosemide",
      "dose": "40 mg",
      "frequency": "once daily",
      "change": "changed"
    },
    {
      "name": "Lisinopril",
      "dose": "10 mg",
      "frequency": "once daily",
      "change": "unchanged"
    },
    {
      "name": "Metoprolol succinate",
      "dose": "25 mg",
      "frequency": "once daily",
      "change": "new"
    }
  ],
  "appointments": [
    {
      "appointment_id": "P0020-A1",
      "type": "Lab test (bloodwork)",
      "date": "2026-10-08",
      "critical": false,
      "status": "scheduled"
    },
    {
      "appointment_id": "P0020-A2",
      "type": "Medication review",
      "date": "2026-10-16",
      "critical": false,
      "status": "scheduled"
    },
    {
      "appointment_id": "P0020-A3",
      "type": "Post-op wound check",
      "date": "2026-10-18",
      "critical": true,
      "status": "scheduled"
    }
  ],
  "responses": []
}