{
  "patient_id": "P0047",
  "scenario": "routine",
  "demographics": {
    "name": "Sheila Pollard",
    "age": 55,
    "gender": "non-binary",
    "phone": "896.436.0576",
    "email": "ihanna@hotmail.com",
    "preferred_channel": "phone",
    "language": "English"
  },
  "discharge": {
    "date": "2026-09-30",
    "diagnosis": "COPD exacerbation",
    "summary": "Treated with nebulisers and steroids; inhaler technique reviewed before discharge.",
    "warning_signs": [
      "shortness of breath",
      "lips turning blue",
      "confusion"
    ]
  },
  "medications": [
    {
      "name": "Prednisolone",
      "dose": "30 mg",
      "frequency": "once daily for 5 days",
      "change": "new"
    },
    {
      "name": "Tiotropium",
      "dose": "18 mcg",
      "frequency": "once daily",
      "change": "unchanged"
    }
  ],
  "appointments": [
    {
      "appointment_id": "P0047-A1",
      "type": "Primary care visit",
      "date": "2026-10-14",
      "critical": false,
      "status": "scheduled"
    }
  ],
  "responses": [
    {
      "date": "2026-10-02",
      "channel": "phone",
      "status": "responded",
      "message": "Yes, my daughter will drive me."
    },
    {
      "date": "2026-10-04",
      "channel": "phone",
      "status": "responded",
      "message": "Yes, my daughter will drive me."
    }
  ]
}